Number,question,mapping1_url,mapping1_label,mapping2_url,mapping2_label,mapping3_url,mapping3_label
1,How large is your vascular malformation?,https://hpo.jax.org/app/browse/term/HP:0002597,vascular anomaly ,http://purl.obolibrary.org/obo/NCIT_C25681,size,,
2,Do you have a visible swelling or mass of the vascular malformation?,https://hpo.jax.org/app/browse/term/HP:0002597,vascular anomaly ,http://ncicb.nci.nih.gov/xml/owl/EVS/Thesaurus.owl#C3399,swelling,http://ncicb.nci.nih.gov/xml/owl/EVS/Thesaurus.owl#C48173,visible
3,Is the color of the vascular malformation different from that of your normal skin?,https://hpo.jax.org/app/browse/term/HP:0002597,vascular anomaly ,https://hpo.jax.org/app/browse/term/HP:0001000,Abnormality of skin pigmentation,,
4,"Is the surface/texture of the vascular malformation different from your normal skin? For example irregular, rough, or bumpy.",https://hpo.jax.org/app/browse/term/HP:0002597,vascular anomaly ,https://hpo.jax.org/app/browse/term/HP:0011121,Abnormality of skin morphology,,
5,Do you find that your face looks different or distorted because of the vascular malformation?,https://hpo.jax.org/app/browse/term/HP:0002597,vascular anomaly ,https://hpo.jax.org/app/browse/term/HP:0000271,Abnormality of the face,http://semanticscience.org/resource/SIO_000379,perception
6,Do you find that your body (except your face) looks different or distorted because of the vascular malformation?,https://hpo.jax.org/app/browse/term/HP:0002597,vascular anomaly ,http://purl.obolibrary.org/obo/NCIT_C13041,Body,http://semanticscience.org/resource/SIO_000379,perception
7,Do other people stare at you because of your vascular malformation?,https://hpo.jax.org/app/browse/term/HP:0000735,Impaired social interactions,https://hpo.jax.org/app/browse/term/HP:0002597,vascular anomaly ,,
8,Is your self-confidence reduced because of the vascular malformation?,https://hpo.jax.org/app/browse/term/HP:0031469,Low self esteem,,,,
9,How satisfied are you with the appearance of the vascular malformation?,https://hpo.jax.org/app/browse/term/HP:0002597,vascular anomaly ,http://purl.obolibrary.org/obo/NCIT_C25377,appearance,http://semanticscience.org/resource/SIO_000379,perception